{
  "$schema": "schema.json",
  "includes": [
    "common/common.json"
  ],
  "background": {
    "texture": "guis/priority.png",
    "srcRect": [0, 0, 176, 125]
  },
  "text": {
    "dialog_title": {
      "text": {
        "translate": "gui.ae2.PriorityTuner"
      },
      "position": {
        "left": 8,
        "top": 6
      }
    }
  },
  "widgets": {
    "mode": {
      "left": 60,
      "top": 95,
      "width": 62,
      "height": 20
    },
    "priority": {
      "left": 20,
      "top": 25,
      "width": 138,
      "height": 62
    },
    "priorityInput": {
      "left": 60,
      "top": 50,
      "width": 61,
      "height": 12
    }
  }
}
