{
  "$schema": "schema.json",
  "includes": [
    "common/common.json",
    "common/player_inventory.json"
  ],
  "background": {
    "texture": "guis/portable_cell_pickup_filter.png",
    "srcRect": [0, 0, 176, 253]
  },
  "slots": {
    "PORTABLE_CELL_PICKUP_FILTER": {
      "left": 8,
      "top": 29,
      "grid": "BREAK_AFTER_9COLS"
    }
  },
  "text": {
    "dialog_title": {
      "text": {
        "translate": "gui.ae2.PortableCellPickupFilterTitle"
      },
      "position": {
        "left": 8,
        "top": 6
      }
    },
    "player_inventory_title": {
      "text": {
        "translate": "container.inventory"
      },
      "position": {
        "left": 8,
        "bottom": 95
      }
    }
  },
  "widgets": {
    "back": {
      "left": 152,
      "top": -5,
      "width": 20,
      "height": 20
    }
  }
}
