{
  "$schema": "schema.json",
  "includes": ["common/common.json"],
  "background": {
    "texture": "guis/priority.png",
    "srcRect": [0, 0, 176, 125]
  },
  "text": {
    "dialog_title": {
      "text": {
        "translate": "gui.ae2.WorkInterval"
      },
      "position": {
        "left": 8,
        "top": 6
      }
    }
  },
  "widgets": {
    "back": {
      "left": 152,
      "top": -5,
      "width": 20,
      "height": 20
    },
    "workInterval": {
      "left": 20,
      "top": 30,
      "width": 138,
      "height": 62
    },
    "workIntervalInput": {
      "left": 56,
      "top": 55,
      "width": 65,
      "height": 12
    }
  }
}
