{
  "$schema": "../schema.json",
  "includes": ["../common/common.json"],
  "generatedBackground": {
    "width": 200,
    "height": 216
  },
  "text": {
    "dialog_title": {
      "position": {
        "left": 8,
        "top": 7
      },
      "text": {
        "translate": "gui.ae2.TerminalSettingsTitle"
      }
    },
    "player_pin_rows_label": {
      "position": {
        "left": 10,
        "top": 68
      },
      "text": {
        "translate": "gui.ae2.TerminalSettingsPlayerPinRows"
      }
    },
    "recursive_reserve_label": {
      "position": {
        "left": 10,
        "top": 150
      },
      "text": {
        "translate": "gui.ae2.TerminalSettingsRecursiveIngredientReserve"
      }
    }
  },
  "widgets": {
    "back": {
      "left": 176,
      "top": -5,
      "width": 20,
      "height": 20
    },
    "pinAutoCraftedItemsCheckbox": {
      "left": 10,
      "top": 25,
      "width": 180
    },
    "pinDisplaySortTopRadio": {
      "left": 10,
      "top": 45,
      "width": 85
    },
    "pinDisplayLockedGridRadio": {
      "left": 100,
      "top": 45,
      "width": 90
    },
    "playerPinRowsField": {
      "left": 154,
      "top": 65,
      "width": 36,
      "height": 12
    },
    "notifyForFinishedCraftingJobsCheckbox": {
      "left": 10,
      "top": 85,
      "width": 180
    },
    "clearGridOnCloseCheckbox": {
      "left": 10,
      "top": 105,
      "width": 180
    },
    "autoFillPatternsCheckbox": {
      "left": 10,
      "top": 125,
      "width": 180
    },
    "recursiveReserveField": {
      "left": 154,
      "top": 147,
      "width": 36,
      "height": 12
    },
    "pickBlockCheckbox": {
      "left": 10,
      "top": 25,
      "width": 180
    },
    "craftIfMissingCheckbox": {
      "left": 10,
      "top": 45,
      "width": 180
    },
    "restockCheckbox": {
      "left": 10,
      "top": 65,
      "width": 180
    },
    "magnetCheckbox": {
      "left": 10,
      "top": 85,
      "width": 85
    },
    "pickupToMECheckbox": {
      "left": 100,
      "top": 85,
      "width": 90
    },
    "magnetSettingsButton": {
      "left": 10,
      "top": 142,
      "width": 180,
      "height": 20
    },
    "useInternalSearchRadio": {
      "left": 10,
      "top": 45,
      "width": 75
    },
    "useExternalSearchRadio": {
      "left": 95,
      "top": 45,
      "width": 75
    },
    "rememberCheckbox": {
      "left": 10,
      "top": 67,
      "width": 150
    },
    "autoFocusCheckbox": {
      "left": 10,
      "top": 89,
      "width": 150
    },
    "searchHistoryCheckbox": {
      "left": 10,
      "top": 111,
      "width": 150
    },
    "syncWithExternalCheckbox": {
      "left": 10,
      "top": 133,
      "width": 150
    },
    "clearExternalCheckbox": {
      "left": 10,
      "top": 67,
      "width": 180
    }
  }
}
