{
  "$schema": "schema.json",
  "includes": ["common/common.json"],
  "background": {
    "texture": "guis/craftingcpu.png",
    "srcRect": [0, 0, 238, 185]
  },
  "text": {
    "dialog_title": {
      "position": {
        "left": 8,
        "top": 7
      }
    },
    "cpuListTitle": {
      "position": {
        "top": 7,
        "left": -81
      },
      "text": {
        "translate": "gui.ae2.CraftingCPUs"
      }
    }
  },
  "widgets": {
    "search": {
      "left": 130,
      "top": 5,
      "width": 83,
      "height": 12
    },
    "suspend": {
      "left": 103,
      "bottom": 25,
      "width": 50,
      "height": 20
    },
    "cancel": {
      "left": 163,
      "bottom": 25,
      "width": 50,
      "height": 20
    },
    "scrollbar": {
      "left": 218,
      "top": 19,
      "width": 12
    },
    "back": {
      "left": 214,
      "top": -5,
      "hideEdge": false,
      "width": 20,
      "height": 20
    },
    "selectCpuList": {
      "left": -88,
      "top": 0,
      "width": 94
    },
    "selectCpuScrollbar": {
      "left": -11,
      "top": 19,
      "width": 12
    },
    "verticalToolbar": {
      "left": 0,
      "top": 0
    },
    "terminalStyle": {
      "left": -22,
      "bottom": 24,
      "width": 20,
      "height": 20
    }
  },
  "images": {
    "cpuList": {
      "texture": "guis/cpu_selector.png",
      "textureWidth": 256,
      "textureHeight": 256,
      "srcRect": [0, 0, 94, 164]
    },
    "cpuListButton": {
      "texture": "guis/cpu_selector.png",
      "textureWidth": 256,
      "textureHeight": 256,
      "srcRect": [100, 0, 67, 22]
    },
    "cpuListButtonSelected": {
      "texture": "guis/cpu_selector.png",
      "textureWidth": 256,
      "textureHeight": 256,
      "srcRect": [100, 22, 67, 22]
    }
  }
}
