{
  "$schema": "../schema.json",
  "includes": [
    "terminal.json",
    "encoding/crafting.json",
    "encoding/processing.json"
  ],
  "slots": {
    "BLANK_PATTERN": {
      "left": 147,
      "bottom": 165
    },
    "ENCODED_PATTERN": {
      "left": 147,
      "bottom": 118
    }
  },
  "text": {
    "dialog_title": {
      "text": {
        "translate": "gui.ae2.Terminal"
      },
      "position": {
        "left": 8,
        "top": 6
      }
    },
    "crafting_grid_title": {
      "text": {
        "translate": "gui.ae2.PatternEncoding"
      },
      "position": {
        "left": 8,
        "bottom": 177
      }
    }
  },
  "terminalStyle": {
    "header": {
      "texture": "guis/pattern.png",
      "srcRect": [0, 0, 195, 17]
    },
    "firstRow": {
      "texture": "guis/pattern.png",
      "srcRect": [0, 17, 195, 18]
    },
    "row": {
      "texture": "guis/pattern.png",
      "srcRect": [0, 35, 195, 18]
    },
    "lastRow": {
      "texture": "guis/pattern.png",
      "srcRect": [0, 53, 195, 18]
    },
    "bottom": {
      "texture": "guis/pattern.png",
      "srcRect": [0, 71, 195, 180]
    }
  },
  "widgets": {
    "modeTabButton0": {
      "left": 173,
      "bottom": 174,
      "width": 22,
      "height": 22
    },
    "modeTabButton1": {
      "left": 173,
      "bottom": 153,
      "width": 22,
      "height": 22
    },
    "modePanel0": {
      "left": 9,
      "bottom": 166
    },
    "modePanel1": {
      "left": 9,
      "bottom": 166
    },
    "encodePattern": {
      "left": 147,
      "bottom": 145
    },
    "uploadPattern": {
      "left": 165,
      "bottom": 140,
      "width": 8,
      "height": 8
    },
    "providerSelectionOverlay": {
      "left": 0,
      "top": 0,
      "width": 0,
      "height": 0
    },
    "patternModifierPanel": {
      "left": -126,
      "top": 59,
      "width": 86,
      "height": 180
    },
    "patternModifierPanelAmount0": {
      "left": -63,
      "top": 67,
      "width": 18,
      "height": 20
    },
    "patternModifierPanelAmount1": {
      "left": -63,
      "top": 89,
      "width": 18,
      "height": 20
    },
    "patternModifierPanelAmount2": {
      "left": -63,
      "top": 111,
      "width": 18,
      "height": 20
    },
    "patternModifierPanelAmount3": {
      "left": -63,
      "top": 133,
      "width": 18,
      "height": 20
    },
    "patternModifierPanelAmount4": {
      "left": -63,
      "top": 155,
      "width": 18,
      "height": 20
    },
    "patternModifierPanelAmount5": {
      "left": -63,
      "top": 177,
      "width": 18,
      "height": 20
    },
    "patternModifierPanelClear": {
      "left": -63,
      "top": 199,
      "width": 18,
      "height": 20
    }
  }
}
